{
  "fromDate": "2020-01-01",
  "toDate": "2020-01-31",
  "ukFhlProperty":{
    "income": {
      "periodAmount": 5000.99,
      "taxDeducted": 3123.21,
      "rentARoom": {
        "rentsReceived": 532.12
      }
    },
    "expenses": {
      "premisesRunningCosts": 3123.21,
      "repairsAndMaintenance": 928.42,
      "financialCosts": 842.99,
      "professionalFees": 8831.12,
      "costOfServices": 484.12,
      "other": 99282,
      "travelCosts": 974.47,
      "rentARoom": {
        "amountClaimed": 8842.43
      }
    }
  },
  "ukNonFhlProperty": {
    "income": {
      "premiumsOfLeaseGrant": 42.12,
      "reversePremiums": 84.31,
      "periodAmount": 9884.93,
      "taxDeducted": 842.99,
      "otherIncome": 31.44,
      "rentARoom": {
        "rentsReceived": 947.66
      }
    },
    "expenses": {
      "premisesRunningCosts": 4141.21,
      "repairsAndMaintenance": 582.21,
      "financialCosts": 829.39,
      "professionalFees": 4992.31,
      "costOfServices": 98.21,
      "other": 29.48,
      "residentialFinancialCost": 2884.99,
      "travelCosts": 48.93,
      "residentialFinancialCostsCarriedForward": 483.91,
      "rentARoom": {
        "amountClaimed": 88.21
      }
    }
  }
}